{
  "id": "tsk_98745b29-f27b-498a-b516-3acc4b57a028",
  "title": "Verify committed-scope Cline review recovery fix",
  "description": "REQ-ENGINE-002: Revalidate the Chief's fix allowing Cline review of committed task files and ignoring unrelated malformed session metadata, then obtain a fresh read-only Cline review. Prior task tsk_bacf0c3b-2ba9-4578-9cf7-63f71c98a499 could not continue because the failure was non-retryable under its state machine; this is a focused verification task, not a duplicate implementation.",
  "acceptanceCriteria": "Exact current diff passes npm run kalite and isolated npm run build; node test tools/cline-adapter.test.mjs passes including malformed unrelated metadata; doctor passes after mtime cooldown; a fresh Cline review transcript from a new review identity is present with no write, execute, or unknown-tool violations; review judgment persisted; git diff --check passes; no app files changed and no commit/push.",
  "createdAt": "2026-09-27T21:57:38.524Z",
  "updatedAt": "2026-09-27T22:33:21.446Z",
  "state": "REVIEWING",
  "attempt": 2,
  "maxAttempts": 3,
  "retryableFailure": false,
  "owner": "CHIEF",
  "risk": "LOW",
  "riskReasons": [
    "Low-risk signal: ^docs\\/",
    "Low-risk signal: read.only",
    "Low-risk signal: \\.(?:test|spec)\\.[cm]?[jt]sx?$"
  ],
  "requiresHumanApproval": false,
  "files": [
    "tools/orchestrator.mjs",
    "tools/cline-adapter.mjs",
    "tools/cline-adapter.test.mjs",
    "docs/AJAN-KOORDINASYON.md"
  ],
  "dependencies": [],
  "currentAgent": null,
  "lastError": "Cline 4.1.21 extension is installed but the task URI did not create a session; its installed SharedUriHandler requires an already-visible Cline webview. No fresh session/transcript exists, so review was stopped without fabricating a result. User must open the Cline sidebar in VS Code (read-only + Deep Plan) before retry.",
  "evidenceIds": [
    "ev_875f5d74-21f2-4a41-bf70-d4d43335a829",
    "ev_b7f87aaa-85ef-4f80-b9c3-41013881c154",
    "ev_a5c0b380-848a-47da-8e82-c3ca4c492db2",
    "ev_adc62c1d-e3e2-4708-87e0-9c425433f6e3",
    "ev_eef86ed1-60fc-435b-a1ed-e091e4895e37",
    "ev_ead13fea-e8be-41d4-9eab-911602d4d181",
    "ev_cf58f253-9d26-4fab-a196-3f5cbec5905c",
    "ev_7be8e59a-de41-48a8-b573-44bfc8c8a1b1",
    "ev_33561847-fd12-484e-97e2-e0aa158d6cb1",
    "ev_b76b2deb-e80f-4fba-9d9b-cdc6a35ee87a",
    "ev_191b1afb-46bf-49ce-b0c7-c25efeee3b8a",
    "ev_9ff0f449-7b9b-4b60-b999-8af86a54f14a",
    "ev_2d5a5d90-618c-413e-8ec0-d208a524d140",
    "ev_ab762ae5-79af-4dfb-975d-affbe4adc46f",
    "ev_246672ca-894c-4433-b9b0-332ebd513070",
    "ev_38d852a5-aa1e-4035-8c0b-0cb9806c2863",
    "ev_9f7602ae-8e1b-4251-9d38-dbef8e8a5050",
    "ev_e7dab658-35bc-49dd-b721-1dccef4df7cb",
    "ev_96b9f381-8bad-40c9-84b9-45bafa09faf1"
  ],
  "reviewIds": [],
  "parentTaskId": null,
  "correlationId": "cor_06eec8c4-1862-4744-bed7-07ebafcc5bc6",
  "idempotencyKey": "idem_b9e2a5e3165076a45b94aa8acab901299b05fbacfb500084657d18c486f38569",
  "opencode": null,
  "cline": {
    "sessionId": null,
    "reviewId": "rev_3cff15b546d77e2e08bb5c9c4cee72c1",
    "correlationId": "cor_06eec8c4-1862-4744-bed7-07ebafcc5bc6",
    "reviewIteration": 2,
    "startedAt": "2026-09-27T22:14:56.276Z",
    "status": "CLINE_TIMEOUT",
    "readOnly": true,
    "promptHash": "d2bec741276fd04c160d5c1de7caa38ec564365379cc4d8f4bbbc891fc64cdf4"
  },
  "reviewIteration": 2
}
