{
  "id": "tsk_bacf0c3b-2ba9-4578-9cf7-63f71c98a499",
  "title": "Repair Cline nested session adapter and verify autonomous engine",
  "description": "REQ-ENGINE-001: Complete the existing Cline 4.1.21 review adapter using the actual nested on-disk session format; fix deterministic adapter tests; make orchestrator doctor verify real Cline availability; create/update compact project-map.json; preserve PHASE 2B scope and no additional dependencies. Chief is sole writer for the orchestration-owned files listed here. Browser baseline currently fails from missing NEXT_PUBLIC_SUPABASE_URL; record as external environment limitation.",
  "acceptanceCriteria": "ClineAdapter can find/read sessions in <root>/<sessionId>/<sessionId>.json and messages sibling; safe against symlink/path escape; legacy flat format retained if compatibility is supported; session fixtures match real Cline message shape; unit tests pass including timeout and successful completion; doctor reports installed Cline extension/session store; actual fresh read-only Cline session response retrieved by existing adapter; project map records verified architecture, routes, DB boundaries, capabilities, tests, ownership, and known risks; no PHASE 2B files outside task scope touched; no writes by Cline; npm run kalite and build pass or build is explicitly blocked by verified environment; browser test limitations documented; git diff check clean.",
  "createdAt": "2026-09-27T20:47:28.752Z",
  "updatedAt": "2026-09-27T21:57:11.872Z",
  "state": "FIX_REQUIRED",
  "attempt": 2,
  "maxAttempts": 3,
  "retryableFailure": false,
  "owner": "CHIEF",
  "risk": "LOW",
  "riskReasons": [
    "Low-risk signal: ^docs\\/",
    "Low-risk signal: \\.(?:test|spec)\\.[cm]?[jt]sx?$"
  ],
  "requiresHumanApproval": false,
  "files": [
    "tools/cline-adapter.mjs",
    "tools/cline-adapter.test.mjs",
    "tools/orchestrator.mjs",
    ".agents/orchestrator/state/project-map.json",
    "docs/AJAN-KOORDINASYON.md"
  ],
  "dependencies": [],
  "currentAgent": null,
  "lastError": "Discarding prior build evidence: detached validation worktree used HEAD without current uncommitted changes; rerun quality/build against exact worktree diff.",
  "evidenceIds": [
    "ev_975ba3ec-d574-4ce5-a942-b12044c7d28b",
    "ev_1d2ee674-1c91-4075-8b80-4365cc85079f",
    "ev_c455376d-cc62-4b8f-a813-d2f38c1b75d6",
    "ev_37e0fac1-6eb2-4670-a109-df324ddc6e34",
    "ev_96eddfa8-38f8-4c2b-8f8a-a4bb80500f5f",
    "ev_c8efaced-0006-44b9-9eba-fc2528e34c30",
    "ev_b7adfe69-7df8-4932-9cad-b87ffac5211a",
    "ev_8edca760-fae7-44d6-9899-49342de1dc52",
    "ev_bc052d9f-1123-4d10-9e2d-a59eabbc8973",
    "ev_47e889ca-abbc-45f0-ba8a-2c3879230cc4",
    "ev_67660f4d-1782-4a75-9902-e87077b94c2d",
    "ev_22e36254-65b8-4390-9296-8a35d1030fc4",
    "ev_2af82418-3203-486d-b7c3-a479098f2333",
    "ev_3c1dc7d7-c72d-44e0-aae9-0cf047539fda",
    "ev_c501f3b4-be48-406b-b5e2-9fe78d293db5",
    "ev_36c46ca6-a873-4029-b2ff-c0bed7fb18d7",
    "ev_35850157-679b-472a-8b06-c05fcd756a43",
    "ev_f14513ac-268e-4fca-b804-588d568aad93",
    "ev_9aa8fa5d-6456-451c-8cc8-77e1bd7c2bad"
  ],
  "reviewIds": [],
  "parentTaskId": null,
  "correlationId": "cor_d594f5a7-c012-4b9d-9094-856ae46e3c8d",
  "idempotencyKey": "idem_41535ab6a3e1c23c7431431bfdce435ae4c34523122e8fc548bc4e605f387e51",
  "opencode": null,
  "cline": {
    "sessionId": null,
    "reviewId": "rev_2e04466274dc511fd55a84721e48a8be",
    "correlationId": "cor_d594f5a7-c012-4b9d-9094-856ae46e3c8d",
    "reviewIteration": 1,
    "startedAt": "2026-09-27T21:12:51.589Z",
    "status": "CLINE_RECOVERY_FAILED",
    "readOnly": true,
    "promptHash": "0ff428b09e61cdfb18c1aae70e8dbe6cdc9f87f1a56a194cfab355c81468d4a8"
  },
  "reviewIteration": 1
}
