{
  "id": "tsk_7b60f9ef-ab83-4632-af8c-2e0ffb1ce612",
  "title": "Persist applicant CV uploads and reject foreign CV paths",
  "description": "REQ-APPLY-CV-001: Repair the candidate application form so selected PDF/DOCX files are uploaded through the existing authenticated private CV endpoint and the returned storage_path is submitted instead of the browser filename. The application API must accept cv_url only when the storage_path belongs to a cv_documents row owned by the authenticated candidate; preserve optional CV behavior, existing candidate-role, Turnstile, expiry, and duplicate checks. Update all four locale CV size labels to match the existing 10 MB upload limit. OpenCode is the sole implementation writer; Chief validates; Cline performs read-only review.",
  "acceptanceCriteria": "Selected CV uploads to /api/aday/cv before application POST; submitted cvDosyaYolu equals server-returned storage_path, never File.name; failed upload creates no application; API rejects unregistered or other-candidate storage paths and accepts registered paths owned by the current candidate; no-CV submission remains optional; only PDF/DOCX up to 10 MB are described in tr/en/ru/he; type-check/lint pass; no new dependency; no commit by OpenCode.",
  "createdAt": "2026-09-27T22:18:00.947Z",
  "updatedAt": "2026-09-27T22:45:02.122Z",
  "state": "REVIEWING",
  "attempt": 1,
  "maxAttempts": 3,
  "retryableFailure": false,
  "owner": "OPENCODE",
  "risk": "HIGH",
  "riskReasons": [
    "High-impact signal: \\bapi\\b"
  ],
  "requiresHumanApproval": false,
  "files": [
    "app/[yerel]/ilan/[slug]/page.tsx",
    "app/api/basvurular/route.ts",
    "i18n/mesajlar/tr.json",
    "i18n/mesajlar/en.json",
    "i18n/mesajlar/ru.json",
    "i18n/mesajlar/he.json"
  ],
  "dependencies": [],
  "currentAgent": "OPENCODE",
  "lastError": null,
  "evidenceIds": [
    "ev_73ebd433-7fa6-4b12-ab49-c1abbc140b15",
    "ev_5529deb2-8fec-49fb-ab28-ec53783d5459",
    "ev_cc8fb98b-527e-4758-908c-0fe5fe6571a5",
    "ev_cc2df631-cc59-4282-9741-e381e64b51eb",
    "ev_bfe8a6d5-f836-4ec5-a259-4896531334d7",
    "ev_db4e5bc5-cffd-408c-857c-235bfb5dba70",
    "ev_ab700131-7f32-466a-8fdd-296a1714927a",
    "ev_19f3d818-1424-4004-9e8c-c0cc6dfe183e",
    "ev_1a4c2366-91cf-4f8f-9432-fab031348547",
    "ev_38b84830-0bd8-4d91-b1d6-cac6fbc9fb2b",
    "ev_0057d636-539d-425d-983a-895f3773515f",
    "ev_9f63e519-429f-4628-9d2c-72c970905656",
    "ev_b8521ae2-f829-45d4-b2b5-93d847f6a5ea",
    "ev_c3861319-109f-49fe-989b-a586a7c746ed",
    "ev_00adef09-39aa-40af-b4e6-163467230e2f"
  ],
  "reviewIds": [],
  "parentTaskId": null,
  "correlationId": "cor_3905fa37-bedc-495f-aa9d-25f420b38460",
  "idempotencyKey": "idem_57171dd6b7013310f17359d78d4393e4664910c67be8fb1987b5207e793c57f7",
  "opencode": {
    "attempt": 2,
    "sessionId": "ses_f1b0cf193ffezJcAHKyQvSOYjj",
    "projectId": "97c743cd73393b6648837204171935e967f4ae90",
    "providerId": "opencode",
    "modelId": "space-bunny-free",
    "worktree": "D:\\isbulkktc",
    "agent": "build",
    "readOnly": false,
    "createdAt": "2026-09-27T22:18:49.329Z",
    "promptMessageId": "msg_258cfc6b-67fa-4ed0-87a7-c5f853bb92f9",
    "messageId": "msg_0e4f30f0f001Q0rME51LRZfyH5"
  },
  "cline": {
    "sessionId": null,
    "reviewId": "rev_c1f89ec8a4658e0184f4882caeb3c74c",
    "correlationId": "cor_3905fa37-bedc-495f-aa9d-25f420b38460",
    "reviewIteration": 1,
    "startedAt": "2026-09-27T22:34:58.496Z",
    "status": "CLINE_TIMEOUT",
    "readOnly": true,
    "promptHash": "722c05273d6448460b1bc23908fc59d7edb4e24d7ecc24ca79435775e56fb7db"
  },
  "reviewIteration": 1
}
