{
  "id": "tsk_1e87af96-e866-425e-b42f-5c658a3b61e0",
  "title": "Gerçek ilan arama ve detay akışını bağlama",
  "description": "REQ-JOB-LIVE-001: Replace the /ilan-ara demo-only result source with validated public job_posts results and make database-backed job slugs open a real detail page while preserving current demo-slug behavior and the existing CV application flow. Use only evidenced job_posts fields: id, company_id, title, slug, summary, description, location, employment_type, remote_policy, salary_min, salary_max, currency, is_featured, published_at, expires_at; and public company fields company_name, slug, logo_url. Enforce active, published, and not-expired visibility for search and details. Wire search and pagination to the real API; apply only filters with verified column semantics and do not silently pretend unsupported sector, permit, B3, urgent, lodging, ATS, or analytics filters work. Render only actual DB data; do not fabricate defaults or metrics. Add accessible loading/error/empty states and correct localized labels/messages in tr/en/ru/he. Keep the anon/RLS Supabase client and never use the service-role key. Preserve existing CV upload-before-application and candidate-owned storage path validation in the assigned detail page. Keep database schema unchanged and add no dependencies. OpenCode is the sole writer and must leave changes uncommitted.",
  "acceptanceCriteria": "Real DB-backed jobs render in /ilan-ara from GET /api/ilanlar; search/pagination and backed filters produce matching results, while unsupported filters are not shown as applied; malformed DB rows/API failures show explicit error rather than demo/empty success; active/published/expiry constraints hold on list and detail; DB slug renders its real job data and metadata without breaking demo slug pages or CV application; all new text exists in tr/en/ru/he; npm run kalite and npm run build pass; no schema/dependency/secret changes; OpenCode does not commit.",
  "createdAt": "2026-09-27T22:52:10.708Z",
  "updatedAt": "2026-09-28T00:47:47.659Z",
  "state": "REVIEWING",
  "attempt": 2,
  "maxAttempts": 3,
  "retryableFailure": false,
  "owner": "OPENCODE",
  "risk": "HIGH",
  "riskReasons": [
    "High-impact signal: database",
    "High-impact signal: \\bapi\\b"
  ],
  "requiresHumanApproval": false,
  "files": [
    "app/[yerel]/ilan-ara/page.tsx",
    "app/api/ilanlar/route.ts",
    "app/api/ilanlar/[slug]/route.ts",
    "lib/depolar/ilan-arama-deposu.ts",
    "app/[yerel]/ilan/[slug]/page.tsx",
    "app/[yerel]/ilan/[slug]/layout.tsx",
    "bilesenler/ilan/VeritabaniIlanKart.tsx",
    "bilesenler/ilan/VeritabaniIlanDetayi.tsx",
    "bilesenler/ilan/VeritabaniIlanBasvurusu.tsx",
    "i18n/mesajlar/tr.json",
    "i18n/mesajlar/en.json",
    "i18n/mesajlar/ru.json",
    "i18n/mesajlar/he.json"
  ],
  "dependencies": [],
  "currentAgent": "OPENCODE",
  "lastError": "OPENCODE_TIMEOUT; OPENCODE_TIMEOUT: no completed assistant message was retrieved for session ses_f1aed40c4ffe4bKgjSq9trD9U4.; endpoint=GET /session/{sessionID}/message; evidenceId=ev_995f547b-640c-4dbf-a320-1a71e20fdbaf; timestamp=2026-09-27T23:03:19.085Z",
  "evidenceIds": [
    "ev_83826199-8dd3-4ee7-95a9-5e97d248eba1",
    "ev_3266326f-a821-4a47-8a88-1aad9b7979fe",
    "ev_0b8805a2-2256-47dd-b5b7-496f4cb78070",
    "ev_c8c486c3-2eac-43c3-af03-6c71e6e882fa",
    "ev_aece56c6-fd14-4f0d-b67b-7eb436dc681b",
    "ev_d63fd156-b324-4e2e-a39d-81841b699731",
    "ev_3cdd47b9-50f3-49a2-aaaa-d213a575a876",
    "ev_bc4f0b43-df8d-4241-a28c-8eb277ae983b",
    "ev_f4356e72-cd3e-4bcc-bf02-14059085b1c3",
    "ev_7667afdc-6ad3-4f0b-b492-34adbfe239f5",
    "ev_995f547b-640c-4dbf-a320-1a71e20fdbaf",
    "ev_3ac84281-b79e-43de-a39a-5e088c6a2d26",
    "ev_a451f63f-44af-431b-b965-34072d5459a9",
    "ev_c7cafff4-89f1-4921-beb9-4ea99d90c191",
    "ev_99e62333-7612-4eaf-894a-b9224fdc8c23",
    "ev_d15163c8-e1e8-4670-88f0-66a77cac6114",
    "ev_9ba1e302-0621-47b0-a467-257c0596116a",
    "ev_4dd96b33-b51f-45fe-ba2c-58da4d9de66a",
    "ev_287dcf8a-dd49-41a2-aaa2-169b584e57c1"
  ],
  "reviewIds": [],
  "parentTaskId": null,
  "correlationId": "cor_e3b7a90b-769a-4057-9982-ef61df5ff28d",
  "idempotencyKey": "idem_5ebde652e77c6449c40f2edfe8fa786de2f83ab703266740a2900fee7c1cc8e8",
  "opencode": {
    "attempt": 2,
    "sessionId": "ses_f1aed40c4ffe4bKgjSq9trD9U4",
    "projectId": "97c743cd73393b6648837204171935e967f4ae90",
    "providerId": "opencode",
    "modelId": "space-bunny-free",
    "worktree": "D:\\isbulkktc",
    "agent": "build",
    "readOnly": false,
    "createdAt": "2026-09-27T22:53:26.209Z",
    "promptMessageId": "msg_e6d48c7d-23c5-4f3b-ac75-25b55e1c45a6",
    "messageId": null
  },
  "cline": {
    "sessionId": null,
    "reviewId": "rev_d70c43b24987066f806cf0f3de6618e7",
    "correlationId": "cor_e3b7a90b-769a-4057-9982-ef61df5ff28d",
    "reviewIteration": 1,
    "startedAt": "2026-09-28T00:37:44.109Z",
    "status": "CLINE_TIMEOUT",
    "readOnly": true,
    "promptHash": "229581fc3cd8aef16cecb529f0d5027575033da1891c77514d25bfb05384a121"
  },
  "reviewIteration": 1
}
