{
  "id": "tsk_99541582-f790-45a7-a8b6-16dfc5ef6d37",
  "title": "Supabase auth yapılandırma hatasında genel sayfa çökmesini önleme",
  "description": "Child task for parent tsk_1e87af96-e866-425e-b42f-5c658a3b61e0. Browser reproducible: when NEXT_PUBLIC_SUPABASE_ANON_KEY contains a rejected placeholder, UstGezinmeCubugu useEffect calls tarayiciIcinSupabaseOlustur without handling OrtamYapilandirmaHatasi, causing Next.js Application error and hiding the /ilan-ara page-level explicit API 503 state. Fix only the authorized navigation component and its four locale message files. Keep auth fail-closed; do not invent credentials, bypass environment validation, or create a fake Supabase client. On initialization failure, preserve rendering of public pages and surface a concise accessible localized auth-configuration status. Handle sign-out errors explicitly if relevant. No new dependencies, no secret/env edits, no commit. Cline is read-only/Deep Plan; Chief owns terminal tests.",
  "acceptanceCriteria": "With rejected/missing NEXT_PUBLIC_SUPABASE_ANON_KEY, /ilan-ara renders without a client-side exception and presents an accessible localized configuration/auth status plus the API error state; with valid key, auth state and sign-out behavior stay unchanged; all new text exists in tr/en/ru/he; npm run kalite passes; no secret/config/schema/dependency changes; OpenCode leaves changes uncommitted.",
  "createdAt": "2026-09-28T00:17:50.457Z",
  "updatedAt": "2026-09-28T00:35:19.793Z",
  "state": "REVIEWING",
  "attempt": 1,
  "maxAttempts": 3,
  "retryableFailure": false,
  "owner": "OPENCODE",
  "risk": "HIGH",
  "riskReasons": [
    "High-impact signal: \\bauth\\b",
    "High-impact signal: \\bapi\\b"
  ],
  "requiresHumanApproval": false,
  "files": [
    "bilesenler/genel/UstGezinmeCubugu.tsx",
    "i18n/mesajlar/tr.json",
    "i18n/mesajlar/en.json",
    "i18n/mesajlar/ru.json",
    "i18n/mesajlar/he.json"
  ],
  "dependencies": [],
  "currentAgent": "OPENCODE",
  "lastError": null,
  "evidenceIds": [
    "ev_18535dca-7dee-4ff4-8e08-68da3202eb38",
    "ev_e90a9cbb-f404-4aa5-afaf-cbedfd144dc0",
    "ev_199cac20-1cb4-4c14-8dfd-37e0f976a41f",
    "ev_c63943c2-3302-4d71-ad1d-05150cbebee3",
    "ev_08b3a641-b6ac-4737-8d6b-8c9969fc869c",
    "ev_086f7652-dbe8-429e-90f9-213020532c83",
    "ev_0a1b91f9-92ac-47c3-9f45-24b6045394c1",
    "ev_71f05c93-0d51-47c8-aad9-c2966df6d904",
    "ev_316c2dbf-a032-4ce0-acb2-f55b6691d19e",
    "ev_3cd76eeb-d5c1-4321-bcbc-fa62dfa23163",
    "ev_e2c0dc4d-6d9c-4a4d-adae-18396901171b",
    "ev_0bdc4bef-04a6-41f4-a60a-5d085b236b54",
    "ev_f84837f0-2798-4933-b826-5cf8f734c8e8",
    "ev_3580ea46-2d25-4cdf-a307-bc544d0b31f3",
    "ev_91fa2afa-a084-4c30-8b4e-d089c5a21545"
  ],
  "reviewIds": [],
  "parentTaskId": "tsk_1e87af96-e866-425e-b42f-5c658a3b61e0",
  "correlationId": "cor_15b85ab3-4f4f-423e-9eed-38a85cd2d341",
  "idempotencyKey": "idem_bacd2df3b3581ea73c4d31d5a4af04f75ae750d171bb781a851640578c87b315",
  "opencode": {
    "attempt": 2,
    "sessionId": "ses_f1a9f6dcfffegUb6aZr1wkpiBP",
    "projectId": "97c743cd73393b6648837204171935e967f4ae90",
    "providerId": "opencode",
    "modelId": "space-bunny-free",
    "worktree": "D:\\isbulkktc",
    "agent": "build",
    "readOnly": false,
    "createdAt": "2026-09-28T00:18:26.502Z",
    "promptMessageId": "msg_cab8df04-6caa-422f-a711-1e8532590168",
    "messageId": "msg_0e562e8ed001pxdF32i2hn9l39"
  },
  "cline": {
    "sessionId": null,
    "reviewId": "rev_ef6ea818b57e310068ae29138a0039f2",
    "correlationId": "cor_15b85ab3-4f4f-423e-9eed-38a85cd2d341",
    "reviewIteration": 1,
    "startedAt": "2026-09-28T00:25:15.314Z",
    "status": "CLINE_TIMEOUT",
    "readOnly": true,
    "promptHash": "3175a59a230629351d706a9dc994dddcf08b87bc7186e8181119e5c3cffa049c"
  },
  "reviewIteration": 1
}
